{
  "schema_version": "1.0.0",
  "tenant_id": "tenant-example",
  "revision_set_id": "rev-example",
  "artifact_id": "nosql-ir-example",
  "status": "READY",
  "content_hash": "e94cc867cd87613c5711f9e4ca3696f20b44363872df26b58d6087d7ba4473fd",
  "evidence_refs": [
    "evidence://example/native-run"
  ],
  "nodes": [
    {
      "id": "N1"
    }
  ],
  "edges": [],
  "semantic_gaps": []
}
